{
  "schema_version": 1,
  "diagram_type": "architecture",
  "meta": {
    "title": "pi-agent Extension Architecture",
    "subtitle": "21 extensions — registration topology (static vs dynamic) and verified runtime-import dependencies",
    "output": "ir/pi-agent-extensions.architecture.html",
    "visual_preset": "blueprint",
    "quality_profile": "standard",
    "views": [
      { "id": "registration-topology", "label": "Registration topology", "focus": ["core-task","hermes-memory","superpowers","wayfind","web-access","obsidian","btw","file2md","subagent","workflow","knowledge-card","power-tool","tool-gate","flux2","krea2","ltx","research-tool","zai-mcp","movie-director","deploy","archify"], "note": "Static extensions enter the --exe binary; dynamic ones are jiti -e, source/bundle only." },
      { "id": "memory-knowledge", "label": "Memory & knowledge", "focus": ["hermes-memory","knowledge-card","research-tool","obsidian"], "note": "Persistent memory, zettelkasten RAG, and the vault they share." },
      { "id": "media-gen", "label": "Media generation", "focus": ["flux2","krea2","ltx","movie-director","tool-gate"], "note": "Native director wrappers + orchestrator, gated by tool-gate." },
      { "id": "agent-infra", "label": "Agent infra", "focus": ["core-task","subagent","workflow","power-tool","btw","superpowers","wayfind"], "note": "Task cockpit, subagent dispatch, fan-out, diagnostics, skills." }
    ]
  },
  "components": [
    { "id": "core-task", "type": "backend", "label": "Core Task", "sublabel": "goal cockpit · todos · ask_user", "pos": [60, 140], "size": [160, 58], "tag": "static" },
    { "id": "wayfind", "type": "backend", "label": "Wayfind", "sublabel": "decision-chain skills", "pos": [280, 140], "size": [160, 58], "tag": "static" },
    { "id": "hermes-memory", "type": "database", "label": "Hermes Memory", "sublabel": "persistent memory · FTS5", "pos": [500, 140], "size": [160, 58], "tag": "static" },
    { "id": "superpowers", "type": "backend", "label": "Superpowers", "sublabel": "14 composable skills", "pos": [720, 140], "size": [160, 58], "tag": "static" },
    { "id": "knowledge-card", "type": "database", "label": "Knowledge Card", "sublabel": "zettelkasten · graph RAG", "pos": [940, 140], "size": [160, 58], "tag": "static" },
    { "id": "power-tool", "type": "backend", "label": "Power Tool", "sublabel": "diagnostics · schema-cost", "pos": [1160, 140], "size": [160, 58], "tag": "static" },

    { "id": "btw", "type": "backend", "label": "BTW", "sublabel": "side-conversation modal", "pos": [60, 300], "size": [160, 58], "tag": "static" },
    { "id": "file2md", "type": "backend", "label": "File2MD", "sublabel": "file → Markdown bridge", "pos": [280, 300], "size": [160, 58], "tag": "static" },
    { "id": "subagent", "type": "backend", "label": "Subagent", "sublabel": "isolated subagent dispatch · leaf", "pos": [500, 300], "size": [160, 58], "tag": "static" },
    { "id": "workflow", "type": "backend", "label": "Workflow", "sublabel": "dynamic multi-agent fan-out", "pos": [720, 300], "size": [160, 58], "tag": "static" },
    { "id": "obsidian", "type": "database", "label": "Obsidian", "sublabel": "project-local vault", "pos": [940, 300], "size": [160, 58], "tag": "static" },
    { "id": "web-access", "type": "external", "label": "Web Access", "sublabel": "search · fetch · video", "pos": [1160, 300], "size": [160, 58], "tag": "static" },

    { "id": "tool-gate", "type": "security", "label": "Tool Gate", "sublabel": "keyword-gated heavy tools", "pos": [60, 540], "size": [160, 58], "tag": "dynamic · thin" },
    { "id": "flux2", "type": "backend", "label": "Flux2", "sublabel": "swift flux2 director", "pos": [280, 540], "size": [160, 58], "tag": "dynamic" },
    { "id": "krea2", "type": "backend", "label": "Krea2", "sublabel": "swift krea2 director", "pos": [500, 540], "size": [160, 58], "tag": "dynamic" },
    { "id": "ltx", "type": "backend", "label": "LTX", "sublabel": "swift ltx-video director", "pos": [720, 540], "size": [160, 58], "tag": "dynamic" },
    { "id": "research-tool", "type": "backend", "label": "Research Tool", "sublabel": "video collect · vault", "pos": [940, 540], "size": [160, 58], "tag": "dynamic · thin" },
    { "id": "zai-mcp", "type": "external", "label": "ZAI MCP", "sublabel": "z.ai MCP as pi tools", "pos": [1160, 540], "size": [160, 58], "tag": "dynamic · thin" },

    { "id": "movie-director", "type": "backend", "label": "Movie Director", "sublabel": "video orchestration", "pos": [280, 700], "size": [160, 58], "tag": "dynamic · thin" },
    { "id": "deploy", "type": "cloud", "label": "Deploy", "sublabel": "builds ALL ext bundles (build-time)", "pos": [720, 700], "size": [160, 58], "tag": "dynamic · thin" },
    { "id": "archify", "type": "cloud", "label": "Archify", "sublabel": "IR → HTML diagrams", "pos": [940, 700], "size": [160, 58], "tag": "dynamic · thin · skills" }
  ],
  "boundaries": [
    { "kind": "region", "label": "Static — native import · in --exe binary", "wraps": ["core-task","hermes-memory","superpowers","wayfind","web-access","obsidian","btw","file2md","subagent","workflow","knowledge-card","power-tool"] },
    { "kind": "region", "label": "Dynamic — jiti -e · source/bundle only", "wraps": ["tool-gate","flux2","krea2","ltx","research-tool","zai-mcp","movie-director","deploy","archify"] }
  ],
  "connections": [
    { "from": "flux2", "to": "file2md", "label": "imports" },
    { "from": "flux2", "to": "workflow", "label": "imports", "fromSide": "top", "toSide": "bottom", "via": [[360, 440], [800, 440]], "labelAt": [580, 440] },
    { "from": "hermes-memory", "to": "subagent", "label": "imports", "labelAt": [580, 249] },
    { "from": "knowledge-card", "to": "obsidian", "label": "imports", "labelAt": [1020, 249] },
    { "from": "knowledge-card", "to": "subagent", "label": "imports", "fromSide": "bottom", "toSide": "top", "via": [[1020, 250], [580, 250]], "labelAt": [800, 250] },
    { "from": "movie-director", "to": "flux2", "label": "orchestrates" },
    { "from": "movie-director", "to": "krea2", "label": "orchestrates" },
    { "from": "movie-director", "to": "ltx", "label": "orchestrates" },
    { "from": "movie-director", "to": "workflow", "label": "imports", "fromSide": "top", "toSide": "bottom", "via": [[360, 640], [900, 640], [900, 440], [800, 440]], "labelAt": [640, 640] },
    { "from": "research-tool", "to": "obsidian", "label": "imports" },
    { "from": "wayfind", "to": "core-task", "label": "imports" },
    { "from": "workflow", "to": "subagent", "label": "imports" }
  ],
  "cards": [
    { "dot": "cyan", "title": "Static vs Dynamic", "items": ["Static extensions are native imports in static-extensions.ts, bundled into the --exe binary and present in every mode.", "Dynamic extensions load via jiti -e (manifest extensions[]) in source/bundle mode only; the -e flags are dropped in --exe mode, so they are absent from the compiled binary.", "btw was extracted from power-tool; subagent was extracted from workflow — provenance only, not runtime edges."] },
    { "dot": "rose", "title": "bundleMode", "items": ["thin bundles exclude dev/heavy deps to keep the registered footprint small.", "tool-gate, research-tool, zai-mcp, movie-director, deploy, and archify are thin."] },
    { "dot": "emerald", "title": "Surfaces & tool-gate", "items": ["Manifest arrays: extensions[] (dynamic), staticExtensions (static), skills[], and binarySkills[] (the subset carried into the binary).", "tool-gate keeps core tools always on and gates heavy media tools behind keyword matching — no cross-extension imports, so it appears in this legend, not as an edge."] }
  ]
}
